{
  "metadata": {
    "title": "The Ulterior Game: Corner and the Cautious Believer",
    "methodology": "i2t-v1.4.0",
    "target_runtime": "exoskeleton",
    "source_document": "data/source/interpersonal-game-ulterior-transaction.md",
    "i2t:relation_to_canonical": "predicate-layer",
    "layer-predicate": "extracts_psychological_payoff",
    "layer-stats": {
      "nodes": 2,
      "edges": 1,
      "incidences": 2
    }
  },
  "nodes": [
    {
      "id": "agent:cautious_believer",
      "kind": "node",
      "label": "Cautious Believer (Prudence Hook)",
      "attrs": {
        "system_type": "agent",
        "psychological_role": "conscientious_accommodator"
      }
    },
    {
      "id": "agent:initiator",
      "kind": "node",
      "label": "Initiator (Covert Hidden Agenda)",
      "attrs": {
        "system_type": "agent",
        "psychological_role": "fear_driven_controller"
      }
    }
  ],
  "edges": [
    {
      "id": "edge:interactivity:asymmetric_payoff_extraction",
      "attrs": {
        "i2t:category": "interactivity",
        "i2t:predicate": "extracts_psychological_payoff",
        "i2t:evidence": "The payoff of the game is psychological stabilization for the initiator at the expense of cognitive exhaustion for the believer."
      }
    }
  ],
  "incidences": [
    {
      "edge": "edge:interactivity:asymmetric_payoff_extraction",
      "node": "agent:initiator",
      "role": "stabilized_beneficiary"
    },
    {
      "edge": "edge:interactivity:asymmetric_payoff_extraction",
      "node": "agent:cautious_believer",
      "role": "exhausted_hostage"
    }
  ]
}