{
  "$schema": "https://topothink.org/schema/v1.0.0/hypergraph.json",
  "metadata": {
    "title": "Strategic Resource Extraction & Negotiation in Mating Markets",
    "methodology": "i2t-v1.4.0",
    "target_runtime": "exoskeleton"
  },
  "nodes": [
    {
      "id": "subsystem:mating_market_environment",
      "kind": "node",
      "label": "Digital Mating Market Environment",
      "attrs": {
        "system_type": "subsystem_boundary",
        "domain": "mating_market"
      }
    },
    {
      "id": "stock:erotic_capital",
      "kind": "node",
      "label": "Female Erotic Capital & Selectivity",
      "attrs": {
        "system_type": "stock",
        "units": "leverage_index"
      }
    },
    {
      "id": "stock:male_resource_pool",
      "kind": "node",
      "label": "Male Resource Commitment & Investments",
      "attrs": {
        "system_type": "stock",
        "units": "financial_capital"
      }
    },
    {
      "id": "agent:extractor",
      "kind": "node",
      "label": "Resource Extractor / Strategist",
      "attrs": {
        "system_type": "agent",
        "strategy": "vetting_or_rinsing"
      }
    },
    {
      "id": "agent:suitor",
      "kind": "node",
      "label": "Suitor / Target Male",
      "attrs": {
        "system_type": "agent",
        "strategy": "investment_vs_defense"
      }
    },
    {
      "id": "flow:vetting_extraction_rate",
      "kind": "node",
      "label": "Resource Transfer & Vetting Extraction Rate",
      "attrs": {
        "system_type": "inflow"
      }
    },
    {
      "id": "flow:defensive_screening_rate",
      "kind": "node",
      "label": "Suitor Defensive Friction & Withdrawal Rate",
      "attrs": {
        "system_type": "outflow"
      }
    }
  ],
  "edges": [
    {
      "id": "edge:containment:market_boundary",
      "attrs": {
        "i2t:category": "containment",
        "i2t:predicate": "contains",
        "i2t:evidence": "All actors, resource stocks, and extraction interactions operate within the bounded digital mating market environment."
      }
    },
    {
      "id": "edge:interactivity:tactical_engagement",
      "attrs": {
        "i2t:category": "interactivity",
        "i2t:predicate": "couples_in_negotiation",
        "i2t:evidence": "Extractors deploy structured vetting filters while suitors negotiate access and offer financial resource commitments."
      }
    },
    {
      "id": "edge:state_change:R1_tactical_escalation",
      "attrs": {
        "i2t:category": "state_change",
        "i2t:predicate": "drives_coevolutionary_race",
        "i2t:relation_to_canonical": "type-quotient",
        "i2t:evidence": "Tactical success in resource extraction amplifies female erotic leverage, driving sophisticated counter-detection and enhanced extraction masks."
      }
    },
    {
      "id": "edge:state_change:B1_defensive_balancing",
      "attrs": {
        "i2t:category": "state_change",
        "i2t:predicate": "balances_extraction_losses",
        "i2t:relation_to_canonical": "type-quotient",
        "i2t:evidence": "High extraction rates deplete male resource pools and trigger suitor skepticism, leading to 50/50 demands, transactional screening, or market exit."
      }
    },
    {
      "id": "edge:reference:sex_ratio_signal",
      "attrs": {
        "i2t:category": "reference",
        "i2t:predicate": "informs_market_asymmetry",
        "i2t:evidence": "Platform demographics (e.g. 4:1 male-to-female ratio on Tinder) passively signal structural asymmetry without altering node identities."
      }
    }
  ],
  "incidences": [
    {
      "edge": "edge:containment:market_boundary",
      "node": "subsystem:mating_market_environment",
      "role": "container"
    },
    {
      "edge": "edge:containment:market_boundary",
      "node": "stock:erotic_capital",
      "role": "contained"
    },
    {
      "edge": "edge:containment:market_boundary",
      "node": "stock:male_resource_pool",
      "role": "contained"
    },
    {
      "edge": "edge:containment:market_boundary",
      "node": "agent:extractor",
      "role": "contained"
    },
    {
      "edge": "edge:containment:market_boundary",
      "node": "agent:suitor",
      "role": "contained"
    },
    {
      "edge": "edge:interactivity:tactical_engagement",
      "node": "agent:extractor",
      "role": "negotiator_female"
    },
    {
      "edge": "edge:interactivity:tactical_engagement",
      "node": "agent:suitor",
      "role": "negotiator_male"
    },
    {
      "edge": "edge:state_change:R1_tactical_escalation",
      "node": "stock:erotic_capital",
      "role": "source_stock"
    },
    {
      "edge": "edge:state_change:R1_tactical_escalation",
      "node": "flow:vetting_extraction_rate",
      "role": "driver"
    },
    {
      "edge": "edge:state_change:R1_tactical_escalation",
      "node": "stock:erotic_capital",
      "role": "target_stock",
      "attrs": {
        "loop_polarity": "reinforcing"
      }
    },
    {
      "edge": "edge:state_change:B1_defensive_balancing",
      "node": "stock:male_resource_pool",
      "role": "source_stock"
    },
    {
      "edge": "edge:state_change:B1_defensive_balancing",
      "node": "flow:defensive_screening_rate",
      "role": "driver"
    },
    {
      "edge": "edge:state_change:B1_defensive_balancing",
      "node": "stock:male_resource_pool",
      "role": "target_stock",
      "attrs": {
        "loop_polarity": "balancing"
      }
    },
    {
      "edge": "edge:reference:sex_ratio_signal",
      "node": "subsystem:mating_market_environment",
      "role": "observed_context"
    },
    {
      "edge": "edge:reference:sex_ratio_signal",
      "node": "agent:suitor",
      "role": "observer"
    }
  ]
}
