{
  "metadata": {
    "title": "The Ulterior Game: Corner and the Cautious Believer",
    "methodology": "i2t-v1.4.0",
    "target_runtime": "exoskeleton",
    "source_document": "data/source/interpersonal-game-ulterior-transaction.md",
    "i2t:relation_to_canonical": "predicate-layer",
    "layer-predicate": "contains",
    "layer-stats": {
      "nodes": 5,
      "edges": 1,
      "incidences": 5
    }
  },
  "nodes": [
    {
      "id": "subsystem:relational_dyad",
      "kind": "node",
      "label": "Interpersonal Relational Dyad",
      "attrs": {
        "system_type": "subsystem_boundary"
      }
    },
    {
      "id": "stock:cognitive_exhaustion",
      "kind": "node",
      "label": "Cognitive Exhaustion & Eroded Self-Trust",
      "attrs": {
        "system_type": "stock",
        "units": "dissonance_index"
      }
    },
    {
      "id": "agent:cautious_believer",
      "kind": "node",
      "label": "Cautious Believer (Prudence Hook)",
      "attrs": {
        "system_type": "agent",
        "psychological_role": "conscientious_accommodator"
      }
    },
    {
      "id": "stock:moral_asymmetry",
      "kind": "node",
      "label": "Moral Asymmetry & Indebtedness",
      "attrs": {
        "system_type": "stock",
        "units": "obligation_units"
      }
    },
    {
      "id": "agent:initiator",
      "kind": "node",
      "label": "Initiator (Covert Hidden Agenda)",
      "attrs": {
        "system_type": "agent",
        "psychological_role": "fear_driven_controller"
      }
    }
  ],
  "edges": [
    {
      "id": "edge:containment:dyad_boundary",
      "attrs": {
        "i2t:category": "containment",
        "i2t:predicate": "contains",
        "i2t:evidence": "Every game operates on two distinct communicative levels simultaneously... within the interpersonal relation."
      }
    }
  ],
  "incidences": [
    {
      "edge": "edge:containment:dyad_boundary",
      "node": "subsystem:relational_dyad",
      "role": "container"
    },
    {
      "edge": "edge:containment:dyad_boundary",
      "node": "agent:initiator",
      "role": "contained"
    },
    {
      "edge": "edge:containment:dyad_boundary",
      "node": "agent:cautious_believer",
      "role": "contained"
    },
    {
      "edge": "edge:containment:dyad_boundary",
      "node": "stock:moral_asymmetry",
      "role": "contained"
    },
    {
      "edge": "edge:containment:dyad_boundary",
      "node": "stock:cognitive_exhaustion",
      "role": "contained"
    }
  ]
}