{
  "metadata": {
    "title": "The Ulterior Game: Corner and the Cautious Believer",
    "methodology": "i2t-v1.4.0",
    "target_runtime": "exoskeleton",
    "source_document": "data/source/interpersonal-game-ulterior-transaction.md",
    "i2t:relation_to_canonical": "predicate-layer",
    "layer-predicate": "appeals_to_prudence",
    "layer-stats": {
      "nodes": 2,
      "edges": 1,
      "incidences": 2
    }
  },
  "nodes": [
    {
      "id": "agent:cautious_believer",
      "kind": "node",
      "label": "Cautious Believer (Prudence Hook)",
      "attrs": {
        "system_type": "agent",
        "psychological_role": "conscientious_accommodator"
      }
    },
    {
      "id": "agent:initiator",
      "kind": "node",
      "label": "Initiator (Covert Hidden Agenda)",
      "attrs": {
        "system_type": "agent",
        "psychological_role": "fear_driven_controller"
      }
    }
  ],
  "edges": [
    {
      "id": "edge:reference:overt_narrative_appeal",
      "attrs": {
        "i2t:category": "reference",
        "i2t:predicate": "appeals_to_prudence",
        "i2t:evidence": "The initiator presents a posture of delicate vulnerability: 'I have been wounded before; I move slowly and require complete emotional safety.' This overt message appeals directly to the cautious believer's self-image."
      }
    }
  ],
  "incidences": [
    {
      "edge": "edge:reference:overt_narrative_appeal",
      "node": "agent:initiator",
      "role": "overt_speaker"
    },
    {
      "edge": "edge:reference:overt_narrative_appeal",
      "node": "agent:cautious_believer",
      "role": "intended_audience"
    }
  ]
}